title,//,sentence,//,Toefl,::
"“In difficult situation, the teacher who give me hope and dream”",//,"When I was the third grade of high school, I got an extra-curricular English teacher. And I worked harder, but it was not able to pick up my English grade.
 
I failed to get into the college and then I had to repeat college entrance exam. I went to my parents and I said “ Dad! Mom! I will take up the challenge of retaking the entrance examination! ” and then my mom and dad had no say and there was silence in the room. I expected a positive answer. But my parents said that “Young Suk, It is not a good idea, we can’t agree with your opinion. If you would repeat college entrance examination, It is not guaranteed to improve grade for 1 year.“ this answer did not satisfy me.  My parent‘s character is realistic and skeptical. Sometime it hurts me.
 
After I seriously struggled with the matter, I decided to try to repeat college entrance examination through self-teaching myself, despite of the objections of my parents. I told my parent about my plan. My parents did not say anything.  I was to study the reading room near my house. I went there with pack lunches, because I did not have money. I studied alone except for English. I had courage to call my extra-curricular teacher who taught me before and I called. At that instant, the telephone was trembled as my heart. Though the receiver, I said “Teacher ! I am Young Suk. I decided to study for college entrance examination again. But, it is difficult to study English alone . Can you help me? Actually I don’t have any money but If you help me, I will repay for your favor!!”  Centainly it was rude request to teacher. I felt shame and nervous . But I had  little hope.  Surprisingly, the teacher’s response was favorable. Teacher said that “ Are you trying again examination for college entrance? Oh I feel sorry. Okay let try again with me! After 10 minutes, can I meet you at McDonalds on the Academic streets?” I was very surprised and I replied loudly “Yes, I can!!” After a while, I went to McDonald on the Academic streets. Even my teacher arrived faster than me. I opened the door with a heart pounding. I greeted gladly teacher. “Hello! Teacher!!! It is been a long time. Nice to meet you” my teacher was reading the English newspaper and said “ Hi ! Young Suk!! “
 
We were going to have one study meeting per week, because he was a postgraduate student at that time. I thanked him a lot. Thanks him, I felt that I could pass the examination right now. After we ended our talking, we walked on the Academic streets. When I walked alone on the Academic streets, I always felt lonely. However, today, thanks to the teacher walking with me, I felt better and more confident than ever before.
 
 The teacher always taught me English thoroughly and efficiently. And when I asked something about English he always taught kindly like an older brother. Once, I could not remember a certain word exactly. I tried remembering the word exactly. However, I was not able to remember the word. Eventually, I sent the clues about the word the teacher. And then after a while, he sent the exact word. The teacher was so nice to me. I appreciated a lot of the teacher and I decided that “I will repay for his kindness and I should be the man like him”
 
He majored in Economics at the University. When he had to decide, he always thought rationally. When he bought products, after comparing product’s price and function thoroughly, he decided to buy. Once, we went to market to buy Coke. After he compared bottle Coke’s price, quantity and can Coke’s price, quantity, he said “Both price were same.” And then he picked up the can Coke. I was wondering and I asked “Many people like the bottle Coke. But why do you choose the can Coke?” And he replied “Both Coke’s price is same. The bottle Coke easily exit the bubble, while the can Coke do not get out of the bubble easily. And he said “Many people buy products without price comparison. Young Suk, when you buy a product, it is not wise to buy without price comparison. It is the theory of the price comparison in Economics.” After that, when he purchased products, he liked mathematical calculations. He was so nice to me and he was very rational person
 
He sometime taught me the theory of Economics and introduce that Economics is how useful in everyday life. He looked like so smart through my eyes. At that moment, I thought that “I should be the man who is smart and kind like my teacher. And I will major in Economics!“ and As I told him that I will major in Economics, he really was pleased and encouraged me “ Young Suk, I am sure that You will be the best Economics student !” He always encouraged me.    
 
Our class was continued in September. Although from September to November, I had to study alone, I did not feel lonely or fear. Instead of that, I felt confident. In November, I applied for the Korea SAT. And then I received my report card. At the instant, I could not stop talkin. My grade was improved especially in English! I decided to apply for Economics at University. My parents seriously worried that about my applying because It was difficult to admission to Economics. However, this time, my parent believed me. My admission was not guaranteed. The day of the announcemen, I tried to check my result with trembling heart. As the result, I got a admission in Economics! I was very happy. That night, my family enjoyed the party. And I reminded my teacher.
 
 After my admission, I could not reach him because he went to U.S.A. at the university first day,
 I thought that “I should be the wise man like the teacher as well as the man who help another people.”",//,essay,::
Sports are popular all over the world. Explain why sports are so popular. Use reasons and specific examples to support your answer.,//,"  Many people think that the reason of popular about sport is that sport is interesting because whenever playing sport like a abaseball, many people always concentrate about the game. However, I strongly believe that the reason of sports are popular, we get a lot of positive things during playing a sport because when we play game, our body is much healthier than before and we can get many relationships.
 
           First of all, when we play sport, our body is always getting healthier. In my case, when I was middle school student, I was week. My lung is too week to run long time. At that time, my father recommended me to jog every morning. Actually, first I started jogging, I couldn’t finish the goal. However, whenever I jogged, my lung and my legs were getting stronger than before. Finally, I could get to the goal without problems. As a result, I went to the Il-san Marathon in Korea and I got a second prise. This say that because many people know that sports make them healthier, sport is popular.
 
           In addition, while we are playing a sport, we can get huge relationships because, if we go to the sport club, we can meet a lot of people. In my friend’s case, his hobby was hiking and he was a member of Clark Hiking Club. So he usually hiked the mountain with his friend’s. Whenever he hiked, he could get a lot of friends. At that time, his mother was hurted by a huge car accident, he met a huge problem about taking care of his mother. It was very hard work, however, his hiking club friends started to help him treat her. As a consequence, his mother was healed perfectly. This fact claim that a relationship while hiking with his friends is one of the reason that why sport is popular.
 
           In short, while we are playing a sport, we can get a lof of possitive things for two essencial reason. If you start to exercise something, you can know why sport is popular.",//,essay,::
"In order to stay well-informed, people should get information from various news source.",//,"There has been an argument regarding the issue that people who want to stay well-informed should get information from various news source. There are myriads of people insist that people in modern days get too much information, so it is enough to read one kinds of news. But, from my perspective, it is essential to read various kinds of news source to get well-informed.  

First of all, todays news sources are specialized in their particular fields. A economic newspaper is write the article especially about the economic issues. In case of sports and entertainments are in the same situation. If people want to we-informed, people should earn information from different kinds of news source. To illustrate, research conducted by Korea University verified that specialization of news sources are getting deeper and deeper. That means if people want to know properly, it is necessary to get information from a wide array of news sources.  

Secondly, many news sources are reflecting the certain social tendency. If we keep getting information from one news source, there are possibility to affect our idea to be bigoted. To be adequately informed, people should get to know the different viewpoint of sources from different kinds of news. For example, South Korea News Committee informed that the tendency of news sources of South Korea is divided into 3 categories. Their character reflects the owner's certain viewpoint about the politic. That illustrates that in order to get balanced knowledge, people try to understand various of viewpoint from various news source.  

To sum up, it is imperative to get information from different kinds of news source. It is because that todays news are too specialized, and some news sources are bigoted. By getting information from different news sources, people can stay well-informed. ",//,essay,::
Reading books is a more satisfying pastime than watching movies.,//,"Some people might argue that watching TV is a more useful hobby than reading books. It is because people can get rid of stress when they watch TV. However, I believe that reading books is a more fulfilling hobby for two reasons. First, people can broaden their views. Second, reading books improves work efficiency.
 
First of all, reading books can allow people to broaden their horizon. By reading a lot of books, they can learn about different worlds of lifestyles, basic customs and cultures. It is obvious that they may go through trial and error. However, they can learn to embrace diversity through this experience. For example, when I had a part-time job, there was an Ethiopian girl who brought home-cooked meals for lunch. She ate with her hands without using utensils, and other students who had never seen such a scene kept their distances from her. On the other hand, being educated on Africa and African table manners through various books, I was perfectly understanding and comfortable with what was taking place.
 
In addition, reading books can encourage people to work with more passion. This is attributed the fact that it can serve as one of the key motivators for them to perform better and to improve themselves. With such motivation, they put in more effort, concentrate better on their tasks, and feel a greater sense of responsibility for their work. According to a research conducted by the Ministry of Labor in 2009, there was a huge difference between two groups of employees in relation to their achievement. Employees in Group A who regularly read books and those in Group B did not. The researchers showed that the former group spent 25% more number of hours on working and performed higher than the latter group. In particular, the employees in Group A followed instructions, submitted assignments on time, and participated actively in group meetings. On the other hand, those in Group B dozed off and lacked focus while working. It can be inferred that reading books frequently has a direct correlation with the amount of effort and energy that employees invest in working.
 
All in all, the importance of my view cannot be underestimated by the fact that it can kill two birds with one stone for the reasons I have mentioned above.",//,essay,::
"Do you agree or disagree?
Universities should spend as much money on sports as they do on libraries.",//,"Some argue that university is designed for academic reasons only. Advocates of this argument would resist the idea of university expanding budgets for promotion of physical activities. However, I believe that physical health which is promoted by sports activities lead to better academic performance and triggers healthy social network and relationship with one another.

Good physical condition which leads to excellent academic performance is well-proved concept through many studies. One research revealed that students who worked out regularly had much better academic performance by 20% than those students who didn't. The study further explained that physical activities lubricates the brain to function in perfect condition, making it in perfect condition to study better. This is why universities should not underestimate the effect of investing money on sports activities. Therefore, universities should provide proper environment for students to exercise on regular basis by putting much money and effort on sports.

Not only sports activities promote physical condition which eventually affect positively on academic performance, it also triggers healthy interaction between students. Most sports games such as soccer and football are designed to play in group. Thus, while playing with many people, students naturally interact with each other and easily make friends. For example, football season was the one of the best time in my college life, as it was good opportunity for me to hang out with friends and meet new people. Bunch of friends went to the football stadium and watch the game cheering our team together. It was a chance to get closer to friends I have, and build new friendship.

To sum up, universities should put enough money to provide adequate environment for students to work out. This is as important as investing money on library since physical health is relevant to better academic performance and sports offer students to socialize. In this regard, I completely agree with the statement.

",//,essay,::
It is better to work three days a week for long hours than to work five days for shorter hours.,//,"First of all, it is much beneficial for today`s people to work three days a week for long hours because they can be allowed to take a long distance trip. It means that they are able to take a trip all around world because visiting other countries requires at least three days, which would be impossible for people who work five days a week. In addition, as they visit many other countries, it can make them to improve their perspectives greatly and help them to reduce their mental stress from work. For example, since a friend of mine works on his own business, he can manage his leisure time well as he wants. So, he have visited many other countries, which as a result it allows him to better understand other cultures, perspectives, and to meet a lot of new people from other countries. These experiences really help him to broaden his social network and to be successful in his business. Through this experience, I strongly believe that spending three days a week has more positive effect on people.

second, going to workplaces for five days a week really makes people tired and to get stressed. In modern society, most people have their own cars and there are scores of transportation such as buses or taxies. So, it can be frequently seen that traffic jams during rush hours, which as a result causes people to get stressed. Stress is the main cause of diseases, short life span, and dissatisfying life. Therefore, working five days a week have negative effect on people`s lives. According to the study done by New York Times, it revealed that the most contributing factor to make workers to get stressed was a traffic jam during rush hours. They also answered that staying at their own cars or buses for long times on the road made them really tired. Through this study, it is clearly proved to me that working five days a week is much beneficial.",//,essay,::
Advantages of Group Work vs Disadvantages of Group Work,//,"The lecturer argues that group work has a lot of disadvantages such as free rider, less-rewarding and low performances. These came out from one experiment which is taken by 6months to indicate the performance of group work. This directly contradicts the reading passage's claim that team project could offer several advantages by their collective intelligence.

To begin with, the lecturer says that more people take more time to make consensus. As many people participating with one group project, various opinions make a lot of troubles to coordinate people's idea into one specific provision. This casts doubt on the reading passage's claim that wide range of people can make a speedy decision making and creative solution.

Next, the lecturer provides one assumption that one or two influential people would handle whole project without gathering whole participants' ideas. As he said, influential person would decide or drop some object without considering others creative opinions. This counters the reading passage’s claim that participant who suggests good idea will be easy to get reward.

Finally, the lecturer claims that group work is not risk free project, whole participant must take entire risk. Not like individual project, group project is commonly big so far its risk is more than individual thing. If project fails, every participant cannot be free from blame. This contradicts the reading passage's claim that group work can scatter their responsibilities into tiny one.",//,essay,::
"These days, decreasing birth rate is a serious crisis in Korea and other rich countries. The problem is expected to greatly damage the countries’ economies. What are the ways we can solve this matter? Use specific details to support your answer.",//,"Decreasing birth rate is similar as an arrow. It’s affecting our country so badly. Due to the decreasing number of newborn babies, a big portion of Korea’s citizens is aged 65 and older. This matter can damage our economy badly because the country should invest a lot of money on taking care of retired seniors. Also, since there aren’t enough babies being given birth, Korea cannot raise new workers of the future. Isn’t there any way we can escape from this situation?
 
 The first thing we can do to solve problems related to the low birth rate is to encourage mothers and fathers to give birth to more children. The biggest reason why parents aren’t having children is because of the amount of money they should spend to raise them. (education fees, money to buy their clothes, etc.) The money spent to raise a child is impossible to be calculated, and parents are concerned if they would face hardships in managing their budgets. In this situation, the government can support them in spending money for their kids. Currently, the government of the Republic of Korea is funding fees spent for a third child in a family. Our country needs to come up with more ideas like this one in order to attract mothers to help increase the birth rate.
 
 The second solution is to let citizens know more about the seriousness of the decreasing birth rate. A lot of parents in Korea aren’t aware of the reasons why low birth rate is such a serious crisis. They don’t know that when a big number of citizens become 65 and older, our nation’s economic growth can slow down because we cannot raise enough workers for companies, and the government needs to spend a big part of people’s taxes for healthcare and retirement life of seniors. In this situation, we can write more news articles and books about the birth rate issue. Then, people who read these would be able to learn how serious the problem is.
 
 Low birth rate is a serious problem in our nation these days, and we have to come up with solutions to it. We can encourage parents to have more children, and write books and show news broadcasts about the issue in order to let the public realize that it is a huge matter. Personally, I think one of the reasons why it is hard to increase the birth rate is because not every citizen of our country is participating in coming up with solutions. It wouldn’t be hard to solve the crisis if all of us help bring our birth rate back to normal. Come on! Think of an idea! There isn’t anything impossible!",//,essay,::
TV programs and movies are obliged to show that good people are rewarded and bad people are punished. Do you agree or disagree?,//,"Some argue that TV programs or movies we watch should be free from any restriction society puts, giving total allowance to express director/artist’s view. However, in my opinion, TV programs should have some extent of obligation to include common moral value or decency to protect young viewers. Further, these video images affect our view on society both consciously and unconsciously.

TV program producers or movie director should consider moral value in their creation because it affects young viewers’ behavior. It is well-known fact that children have tendency to imitate adults’ behavior. It is also applicable truth when they watch TV programs or movies. Especially, many TV programs and movies star celebrities which young people idolize. If such video images contain morally vague concepts, it would affect the youth negatively due to their tendency to emulate role models. Furthermore, the young tends to be less concrete about their morality, not knowing what is good or bad, and have vulnerable mentality. In this case, exposing them to morally ambiguous images damage their morality severely.
 
On top of that, these morally ambiguous images, which bad people get rewarded and good people get punished for example, would not only affect the young but also provoke adults. Visual images have tremendous impact on people. To elaborate, when exposed to these images without knowing it, it would unconsciously have effect on people. One study revealed that a person who watched violent movies have higher tendency to display violent behavior than that who did not. Therefore, putting images such as good people getting punished instead of bad people would damage people’s faith that good deeds result in luck and reward. If such belief continued among people, it would bring serious moral hazard to the society as a whole.

In conclusion, creators of visual images on screen are obliged to contain morally accepted consequence in the story they produce to protect both the young and old. ",//,essay,::
A nation should require all of its students to study the same curriculum until they enter college,//,"The different viewpoint on how to educate students has been a lingering question for all nations. Some argue that setting a fixed curriculum covering various subjects for all the students is more effective than adopting different curriculum for each one. However, in my opinion, opposite is right because each student has their own unique talent which cannot be same with others, and teaching the same curriculum lacks room for creativity.

As mentioned above, teaching the same curriculum for every highschooler is ridicule due to their unique talent of each and everyone. Some students might have artistic potential and others might be math prodigy. These two types of students cannot be taught in the same way. That is, a person who has better potential in art field would be better educated with classes of extended and deeper understanding of drawing or design, and math genius would be much more suited with classes with numbers and calculations. In this way, they can pursuit what they want to achieve in the future more effectively and successfully.

Another equally important reason is that teaching the same material to all the students discards the chance of creativity. Set out curriculum means all the study material is fixed-prepared for the students to be acquired. Thus, all students have to do is to memorize what they are taught. The tests will be given to measure students’ understanding of limited coverage of that study only. Therefore, there is not much room for the learners to perform their intellectual mind.

To wrap it up, all the students studying the same curriculum in high school is ineffective educational structure. Rather, government entity relevant to the education system should come up with better way to stimulate creativity and new ideas among endeavors and expand the room for them to play during the learning process.",//,essay,::
