title,//,sentence,//,Toefl,::
"People do many different things to stay healthy. What do you do for good health? Use specific reasons and examples to support your answer.

",//," I think that health means not only physical health, but also mental health.  Thus, if we maintain our healthful condition, we should carefully concern both conditions in our life.  There are many kinds of activities to maintain both our mental health and physical health.  However, in my case, be in my case, I mainly prefer to exercise in inline-skating and jogging for keeping my physical health, and prefer to listen to music and watch movies for keeping my mental health. 

        To begin with, I mainly practice inline-skating and jogging for an hour every day. Both activities are good choice for maintaining my health, and they are also inexpensive sports.  If you decide to enjoy inline-skate or jogging, you should buy some equipment such as inline boots, repairing tools, body-protectors, and a helmet for inline-sports, or jogging shoes for jogging. It would require some money to buy these things. However, when you buy these equipments, you don't need to spend any more equipment.  For example, a golf club membership in Korea is very expensive. Average prices of the golf club membership are at least eight millions won, so most people in Korea who already have basic golf equipments could not play golf. Of course, the basic golf equipments in Korea are also more expensive than any other country. However, inline-skating and jogging are not expensive sports in Korea. It is also fun and you don't have to pay extra money for skating or jogging. Moreover, both activities are very good for our health. Many doctors say that both sports are good for strengthening respiratory organs and heart, and both also good for improving muscle system of our body. 

        In addition, to relieve mental stress, I prefer to listen to music and watch movies. I am one of the jazz fans and movie fans. When I am stressful, I often go to the movie, or borrow some DVD from DVD store around my home, or listen to jazz music. When I hear jazz music or watch movies, I can relieve my stress and feel comfortable. Actually, I believe that most people do same act like me, because when people listen to merry music or movies, they can alleviate their bad feelings. Moreover, most doctors and psychologists agree that the effects of music and movies can help alleviate one's stress and even cure some serious mental disease such as manic-depressive psychosis, and melancholia. 

        In brief, No one may deny that importance of maintaining physical and mental health is essential for our life, and I believe that Inline skating, jogging, enjoying music and movies are best choices to maintain my life in best way. ",//,essay,::
Some people prefer to spend time with one or two close friends. Others choose to spend time with large number of friends. Compare the advantages of each choice. Which of these two ways of spending time do you prefer? Use specific reasons to support your answer. ,//,"When we spend time with large number of friends, we get the chance to meet various kinds of people. This ables us to train social skill to easily adapt ourselves to different culture or taste. Also, gathering involving many people have a exciting atmosphere that can't be found in groups of small number of people. But I prefer to spend time with one or two close friends for the following reasons. 

  Firstly, spending time with small number of friends provides the comfort and intimacy that gathering of many people might lack. We often feel distressed from the overloaded work and become annoyed with so many people making noises in the restaurant. The comfort and intimacy we get from the gatherings of small number of people might relax our fatigue. 

  Secondly, during the time spending with one or two close friends, we can talk about serious matters and share useful information. Such serious problems seem hard to be shared among large number of people. Talking about problems with one or two close friends might be a good way to release the pressure of the problems. We might even realize the key to the next step of solving the problem. 

  Although there are a lot of advantages in spending time with many friends, I think the advantages of meeting one or two close friends overweigh them. And that is why I prefer to spend time with small number of friends. ",//,essay,::
 Is the ability to read and write more important today than in the past? Why or why not?   ,//,"Recently, our society is getting more and more complex and developed. There are so many attractive matters that we can see, hear and feel that it is easy for us to believe that reading and writing are not important as ever before. However, as far as I know, reading and writing are basic and fundamental tools for expressing oneself and understanding others because they help us arrange one's thought. In addition, as before, the most important way to give others information is not TV show or radio talk show, but reading materials such as journal or books. Thus, I think reading and writing are more important, and here are some reasons for my decision. 

First, it is usually helpful for us to write down what we think or imagine. This is because we can not wirte about something without considering and re-arranging one's idea. For example, every time I prepare test, without re-arranging class note, I could not make a good resualt. It seems that while I try to write down what I read form my class note, text book or some kind of material, the process of writing helps me establish heirachy of knowledge, which make it easy for me to memorize or understand information. 

Second, although seeing, hearing and feeling are important tools of understanding complex and huge amount of information, reading and writng are also important to transper one's knowledge or thought to others. This is because such media as TV, radio and movie can not be easily and deeply understood because we can not memorize or understand them relativly short period time. We can read or write until we fully understand or express. However, due to its speed and duration, it is hard for us to concentrate on that matter. 

In sum, althogh traditional way of understanding and expressing, reading and writing, seems somewhat outdated, they are fundamental and crucial tools of interacting with others. Think of the world without no chance to read or write. How can you express or understand your own or others' knowledge, information, feeling and so forth?   ",//,essay,::
"Smoking should not be permitted in restaurants, and laws that prohibit it should be upheld. ",//,"Smoking in restaurants is a selfish and disrespectful action for other people who came to the restaurant to enjoy their meal. There must be some people who dislike the smell of smoking so much that they can not have a meal with the smell of smoking. Also, it would disturb the people, who are trying to quit smoking. 

Moreover, as we all know, smoking affects second hand smokers in more harmful way than those who actually smokes. Because the restaurant is a place to enjoy a healthy meal, they are expected to be the places in a cleaner and better condition. It is obvious that no one likes to have a meal with the full of smoking. 

As a matter of fact, it is also very harmful and unhealthy for the smokers to eat their meal while they are smoking. By restricting the laws that prohibit people to smoke in the public area, the government or state leister can expect a less number of people who smokes, to keep a society and citizens away from bad influences and effects and also to help smokers quit smoking more conveniently. 

Not only a restaurant, but also other public buildings should not allow people smoking, and more importantly, smokers should realize that their actions of smoking where other people are, is irresponsible therefore should feel ashamed and guilty. ",//,essay,::
It is better for children to grow up in the countryside than in a big city. Do you agree or disagree? Use specific reasons and examples to develop your essay. ,//,"I agree that it is good for children to grow up in the countryside that give many good points. Although people know that the nature is the best textbook for children, they cannot give it to them for many reasons. The good points which can could gain from raising children in the countryside are the life in the natural which give a rest and a health, the friends who have a intimate friendship, and the best educational experiences which can not imagine in the city. 

The children in the city are dependent and weak even in mental. However, the children in the countryside are independent in whatever they do and strong in not only physical but also mental. While the children in the city are surrounded by bad air, various accidents in daily life and many dangerous things, the children in the countryside can have a nice day with a fresh air, a beautiful natural and a peaceful mind. 

The friendship in the city’s children is changeable and beatable by trivial reasons. For the children in the city can have many various friends as like videogame which can be exchanged when they disgust it, they could not make a real and deep relationship with their friends. In the countryside, for the children have not sufficient toys as city’s children, they have to have perseverance and a faith to make a friend. The friendship which be formed by this course is strong and would be sustained for a long time. 

While the children in the city have knowledge which learn from a textbook or an Internet, the children in the countryside can have knowledge from a real experience, which cannot do, in the city. The city’s children have only fast and useless knowledge, however the countryside’s children can have a live and real knowledge by their experience with the natural and self-stimulation. 

In conclusion, Although I have a difficulty in making a decision to raise children in the countryside for job and relationships with colleagues who I have known for long time, if I have a chance and make up a mind resolutely, many good things would be returns for children and also me; the children could obtain a health, an intimate friendship and a best educational environment in the countryside. ",//,essay,::
Your school has enough money to purchase either computers for students or books for the library. Which should your school choose to buy computers or books?  Use specific reasons and examples to support your recommendation.,//,"  I think that both to buy books and computers have some advantages and disadvantages. If my school has a plan to buy something for the school library between books and computers, I would suggest to buy computers for the library, because computers are effective and convenient equipments for most students in terms of accessing up-to-date information, processing information quickly, and utilizing many kinds of school works. 

        First of all, students who work with computers can access up-to-date information. For example, our university library already has a wide variety of books, but most books only contain out-of-date information. Thus, students without computers hardly catch up with up-to-date technologies. Of course, students can ask a librarian to apply some books, which students need, but the process is mostly complex and time-consuming. However, if students can use a computer, these inconvenient things would be solved by computers, because students using computers can easily connect a school network system and Internet, and they can easily find information, which they need. 

        Secondly, students who work with computers can process much information in real time. For instance, if you want to find some books without computers in the library, you would spend a lot of time to find an index card, and to know that the book is still there or lended.  Maybe to find a book would take at least ten minutes without help of the computer. However, if you use a computer, you can direct search the book that you need, and you can get the book in no time. Of course, if you use Internet, you can also find a wide variety of information such as research papers, latest articles, and news in no time. Thus, students with computers can access information more quickly than students without computers. 

        Lastly, computers can be used in a wide variety of school works. For example, now, nowadays students use computers for research and word processing needs. Some teachers use computers for providing their course homework and information.  Moreover, many universities in Korea require students to learn computer, because the process of application of the course are completely computerized. My university also has computerized enrolling system. If the university buys many computers, students who don’t have a computer would be easily enrolled in the course, which they want. 

        In conclusions, I strongly believe that computers would be best choice to greatly improve the environment of the library. Even though books are simple to read, and they do not need such knowledge of the computer, I am sure that quickness-ability, access-ability, and wide application-ability of the computer are more valuable than books. ",//,essay,::
"Do you agree or disagree with the following statement? People should read only those books that are about real events, real people, and established facts. Use specific reasons and details to support your opinion. 
   ",//,"It is needless to say that most books are written by those who have their own respective thoughts and want to have the books to be read by many other people. Simultaneously, the contents of the books should be different to each other. I am for sure it is good to have plenty of thoughts and philosophies in the world so that we can share them. Therefore, I am for the statement that people need to read both fiction and non-fiction for a couple of reasons. It will be viewed from following two aspects. 

  Firstly, one of the critical reasons why people should read both books about real events and unreal events is that we can learn to know what other people are thinking by reading the both kinds of books. The thoughts of other people could be about real phenomena or creative ideas. For example, had it not been for the novel of Aldous L. Huxley, Brave New World, we couldn't even have a chance to imagine how tragic the world would be if the science technology had been developed without conscience. Thanks to the very creative fiction, people in 1932 could be inspired to think about the future. I don't think any other facts in the book can do better to do it than the novel. To sum, people had better have access to other people's creation by reading various kinds of books not just by reading non-fiction. 

  Secondly, the creative thoughts of children should be boosted by a lot of great fiction. We all know that children have much curiosity and try to meet their needs by reading, watching and tasting and so on. I think novels, such as science fiction and fables are very much adequate to satisfy kids. My brother, who majors in shipbuilding technology at the moment, dreamed about becoming a good scientist when he was very young with reading various kinds of scientific novels. I think this could be a good example how much children are affected by creative works of good authors. The creative thoughts of children should not be eroded; instead, it has to be enhanced by good fiction. 

  In conclusion, people have to read fiction as well as established facts because all people want to and have right to share ideas with other great contemporary thinkers and writers. Futhermore, vast imaginary stuff in fiction can develope creativeness of children. That we have many a good novels, which stimulates our imagination, is very adorable in this mechanical and highly standardized society. ",//,essay,::
Many people visit museums when they travel to new places. Why do you think people visit museums? ,//,"When you travel to new place, where is the first place that you want to visit? Answer to this question depend on the characteristics of site. If you are in the area that is famous for beautiful beach, your first trip is possibly the beach. Then, what could be your first stop, if there is no such famous place that attracts you? In my case, generally I take museum as the first stop for my visit because I can understand that area easily, fast and effectively. In addition, museum gives me unforgettable memories. 

First, the most fast and easy way to understand a certain area is to visit museum. We can learn brief history of that area by seeing historical stuff displayed at the museum. What's more, we can find out how that area's economic and cultural status is. In most case, if a certain local government is not in good cultural or economic state, the government tend not to invest on such faculties such as museum. It is because, to them, there are many things they have to invest first. On the contrary, if the local government and that area is flourishing, it is clear that they cherish their historical stuff. 

In addition, we can make some memories about certain place by visiting museum. We can see valuable historical remains that can not be seen at the other area. Furthermore, considering that museum plays an important role of being landmark of the area, we can experience fantastic building and landscape. For example, when I visit "" the Louvre"", what makes me exciting is not only its stuff, but also its building including glass pyramid. If I toured the city without visiting that museum, half of my memories could be lost in my mind. 

In sum, although visiting museum might seem to be somewhat boring, it is quite a useful way of understanding certain area. Museum is abstract of the area's history, culture and life. Without visiting local museum, how can you say that you visit and learn lots of things on that area? 

",//,essay,::
English as an official language. ,//,"Korea achieved brilliant success last 30 years. This miracle was come from perspiration of all people in Korea, especially the laborer who worked at the factory paying low-wage and poor environment. As economy grows rapidly, people concern about whether Korea can become more affluent or not. In Korea’s circumstance where natural resources are limited, talented people need to be trained. With part of that worries, some people urge to use English as an official language. It is inevitable to Korea to survive from globalization which accelerates competitiveness among the nations. How ever, in my opinion, finding our national characteristics is more important than following advanced nations recklessly. 

One of the biggest concerns is that we could lose our emotion of nation. We have more than 2,000 years of history and always proud of our nation. In 2002 World Cup, for instance, Korea showed intensive nationalism throughout the world. We all dressed red shirts and proud of what we made. Another example of our self-esteem is ‘Han-Gul’ which is Korea’s official language. Han-Gul is the perfect language that expresses every human feelings in words and also write every language that people use all over the world. It is a creditable invention that the world language experts acclaimed it. 

In addition, imagine of how impractical of using English in Korea society. How do you going to write Korean’s peculiar thinking? As an example of Korean novel, there are good novels in Korea which could not award novel prize at literature, because Han-Gul could not interpret properly. 

In conclusion, Using English as an official language does not mean fostering national competitiveness. Korea government should devise other alternatives that increase national benefits such as improving educational surroundings or lessening restrict policy to companies so that they can help domestic consumption. Also, People should conserve their cultures and prepare for the globalization. If not, we could be a cultural colony of other advanced nations. ",//,essay,::
Some people prefer to eat at food stands or restaurants.  Other people prefer to prepare and eat food at home. Which do you prefer? Use specific reasons and examples to support your answer. ,//,"As many people are becoming busy with their jobs,hobbies, they tend to go out and eat food from restaurants or fast-food store. They like those place because thay can save time and don't have to worry making food. Despite opposition from many, I prefer to eat food at home. 

First of all, I am able to save a lot of money. Because I'm student, I am not able to afford food price at restaurants 30 days a month and 12 months a year. It was  always my parents who gave a pocket money to me. I realized that the older we are , the more difficult we get a money from parents. Even if I have money to go chow hall, I have tried to keep the money in bank for my future. When we eat food at home, It’s possible to store food that we left. It’s a common sense that most of restaurants have dumped the food away right after customers set off from restaurants. It not only made environmental problems, but also raised the food price. I saw one article in newspaper that government and private companies spent two billion won to recover the environment. I also want to mention about tip culture. It’s recommended to leave 10~15% of your whole food price on the desk, when you leave the restaurant. If the waiter impressively served to you, you would like to leave more money than regular tips. 

  Secondly, eating at home is more safe than restaurant, or food stall. Generally speaking, most restaurants more interest money than any other things. One broadcaster reported the news that most of the fast-food store’s sanitations are terrible. Part time job members usually didn’t  wash their hands when they start working and didn’t use a plastic glove.  A  worker said that a host just always has pushed him to work quickly and didn’t say anything about safty of making food. As you can see, your mother always tries to make healthy food for family members. Whenever she was about to buy some ingredients, she looked carefully about the expiration and the condition of food not the price of that. As a result, Family members are able to feel mother’s love. 

Thirdly, family members can share the feeling of membership. We are so busy with our own businesses that we are no longer interested with  the lives of our near and dear ones.  So I think  that the best way to solve this problem is to make a custom about eating at home at least one time a day. I am sure that they will feel the safety and comfort  each other. 

As we have seen above, there are many benefits eating food at home. It’s not only good to your health, but also good to relationship of family members. ",//,essay,::
It is sometimes said that borrowing money from a friend can harm or damage friendship. Do you agree? Why or why not? Use specific examples to explain your answer.,//,"There is an argument regarding the issue that lending or borrowing money from a friend can damage the friendship. Some people maintain that this behavior don’t affect friendship. However, in my opinion, borrowing money from my friends can affect negatively our friendship because this can damage my friend’s financial statement and might break confidence between friends. 
    First of all, if a person borrow some money from his or her fiend, it can give trouble to the friend because of the financial problem. For example, I am a university student and I earned money by doing part-time job to afford my tuition. In this case, I always have trouble in my financial statement. Two months ago, one of my friends answered me to lend one hundred dollars and I lent the money despite my condition for my friend and consequently I got in financial trouble. Hence, through the experience, I learned that borrowing money from a friend can damage the friendship. 
    Moreover, borrowing money can attack the confidence between friends. If a friend who borrowed some money don’t pay back the money, people might think that the friend doesn’t consider them. According to the research done by the Seoul National University in Korea, people feel sorry when their friends don’t do thoughtfully. To make the matter worse, once the truth is broken between friends, the relation can’t maintain as before. After all, friends break up the relationship each other. Therefore, I think that borrowing money can harm the relationship between friends.   
     In conclusion, I agree the statement that borrowing money from a friend can affect negatively friendship. This is because of the reasons mentioned above that borrowing can affect directly the financial statement of a friend and might reduce the belief between friends. We should make an effort not to borrow money from friends to keep the friendship.   ",//,essay,::
