title,//,sentence,//,Toefl,::
"Do you agree or disagree with the following statement?
The extended family is less important now than in the past",//,"Some argue that the extended family is not as important as it used to be because people’s lifestyle has changed according to development of urban city, which small-sized family is more adaptable. However, in my opinion, there should be more emphasis on the big family in contemporary society. That is, children can improve their social skills from the youth in the extended family and people feel much happier and have more of sense of security.
 
To begin with, the extended family provides much better environment for children to develop their social skills. That is, from the very early age, children get to build relationships with different types of people including grandparents, uncles, aunties, and nephews. Such family members are belong to different age groups and each relationship is different and unique from each other. Therefore, children naturally learn how to communicate with the younger, older, male, or female, developing communication skills dealing with various types of people which they will encounter in the society. Such skills are essential part of life for children to live harmoniously. For example, my friend Min-young was born in the extended family which includes many family members. Her personality is always outgoing, very sociable and popular among friends. I believe such character of her comes from her background having extended family.
 
On top of that, people who grew up in extended family tend to be much happier and feel sense of security more than those people who grew up in the nuclear family. To elaborate, people who belong to the big family have surroundings which they can always get support from. If one is in difficult situation and experiencing hard times in life, he or she can discuss with family members. Since there are many family members who went through many things in life, one can get useful advices from them and overcome difficulties easily. Moreover, family members will not only support physically but also mentally. They will provide emotional support and assistance which would lead to sense of security and comfort. Such comfort is very important living in the stressful contemporary society. Therefore, it is understatement that extended family is less important now than in the past. It is as equally important now as it was in the past.
 
To wrap up, it is obvious that extended family is as crucial as in the past now because it offers better environment for children to improve social skills, and it provides sense of security and comfort to people. In this regard, I completely agree with the statement.",//,essay,::
"Do you agree or disagree with that the opinions of celebrities, such as entertainers and athletes, are more important to younger people than they are to the older people.",//,"These days people can easily express and share their opinions about certain subjects via SNS such as Twitter and Facebook. Obviously, entertainers were one of those who actively put their opinions regarding controversial issues, and I believe that those famous people played a pretty important role in making the younger generations than older ones get interest in these issues.

First of all, younger people pay attention to and care about the opinions and thoughts of celebrities than older generations. This can be seen among the teenagers most of the times, since teens tend to have a longing for certain celebrity they favor and idolize them; hence, feel curiosity towards the thoughts and perspectives he or she has and easily are influenced by these thoughts. For example, an entertainer brought up an issue about animal abuse, and left a sentence saying animals should be treated well since they are also living creatures that have feelings on her own homepage, with a photo she took with her pet dog together. This was noticed by many people who agreed with her view and took part in spreading it to more people, and most of them were teenagers and young people in their 20's, who cared about this celebrity much.

In addition, younger generations are more familiar to using electronic devices and sharing ideas through them, which older people usually are not very interested in. With the drastic development of Informational Technology, younger people were born and grew up with electronic gadgets as more options were attached to them year by year, and ostensibly many celebrities who dominantly use SNS based on the Internet as a way to express their ideas are the young ones who consist this generation. As a result, younger people would look into celebrities' opinions more and be much more exposed to opinions of celebrities than older ones who hardly get a chance to do this; and eventually, younger ones who frequently watched famous people's views would be affected at least to some extent.

To sum up, with the drastic improvement in technology combined with usual attention of younger generations towards their objects of observation, famous, unreachable and respected people, it made the celebrities' perspectives very influential to younger people. This point seems obvious, if it has acted rather as a negative or positive way to us.",//,essay,::
People who do not accept criticism from others cannot be successful at working in a group.,//,"There has been heated debate over the issue of whether people who do not accept criticism from others cannot be successful at working in a group. While there are many good arguments for both positions, the following argument will explain in detail why I agree.

  My first argument for the influence of people should be espoused. This is because people play critical roles in developing our untapped talents. Modern-day people live hectic lives because today's globalized society is increasingly competitive and constantly changing. Consequently, it is difficult for people to discover their personal interests and pursue the fields of study that they prefer. This makes it crucial for people to help us to develop our talents and tap into our full potential. Therefore, people' influence cannot be overlooked in this context. According to a group of education experts at Columbia University, people who are under the close guidance of their co-workers and boss at their workplace decide on their future careers and develop their potential faster than people who are not. The majority of education experts argued that people are likely to be unproductive if they do not fully receive the advice and help of their peers and boss, especially when they are in their potential stages.
 
  Moreover, my strong support for people' influence can be rationalized. This is attributed to the fact that people, with their years of experience, can offer lessons on morality and ethics. People who are not still mentally immature have long way to go before they become experts in their fields. During this long journey, they tend to make many mistakes and are prone to misbehave. However, people can be guided by their closer friends and mates, who can teach them about etiquette and social norms and can thus become good models for society. In this respect, people exert good influence on us. For example, undeveloped people may give in to the temptation of playing computer games all nights long because they are too immature to judge right from wrong. This is why people' influence is an urgent need. With the guidance of them, such as co-workers or boss of us, we can learn how to avoid such temptations and become law-abiding citizens, by listening our advisers' descriptions of their own experiences. Through such lessons, we can become holistic beings.

  In a nut shell, my discussion above presents two stronger arguments for people' influence which I believe effectively convince the reader.",//,essay,::
Letting a friend make a mistake is better than taking action that risks destrotying a friendship,//,"Some people believe that allowing a friend making a mistake is better idea than trying to prevent him or her from it. This is because they think another person's advice may not always work out sometimes. However, I firmly believe that even though it would be risky that destroy a relationship, people should take action for their friends for following reasons: First, one can't make wise decision alone and second, it will worsen a friendship if something gets wrong with a friend.

To begin with, every human being is not perfect creature. Which means we always can't make smart decision by ourselves in all situations. That is why a good friend exists. People should help their friends to do right thing when others seem to walk along the wrong path. For example, I have an old friend named Jihee. Since Jihee has always felt that she needs to study more, she decided to study abroad in United States after she graduated college. After getting in graduate school in California, everything seemed going well with her. However, one day I realized via her friend that she got addicted to alcohol because she could not get used to new life in strange country and had heavy pressure under the a lot of tests she had to pass. As one of closest friend, I was worrying about her situation. So I flew to her place and persuaded her to take off the school for a year and come back to hometown. At first, she refused to take my advice, but she soon went back to Korea with me and got some therapies for her alcohol addiction. If I had not taken any action for her situation, she would be in serious trouble by now. Therefore, it is important to guide friends into right direction rather than sitting back and watch them making wrong decisions.

On top of that, just letting a friend decide any choice can worsen relationship sometimes. If a friend's decision get wrong and something bad happens to her, she may blame on me having not told any advice to her. Thus it would break our friendship. For example, when I was in high school, I used to have a friend Nancy. At that time Nancy was considering breaking up with her boyfriend because he would not respond her messages and calls for two weeks. Even though I saw that guy walking with a strange girl at the shopping mall, I didn't give her any advice because it could hurt her feelings. Also I thought all matters were up to Nancy. However, after she realized the boy was cheating on her, Nancy suddenly blamed on me that I haven't told anything I knew to her. After for a while, Nancy apologized to me about being dramatic, but we could not get along well as we used to. This example implies that sometimes letting a friend making own decisions is not good idea and may break a relationship.

To sum up, I agree with the idea that taking action that risks destroying a friendship Is better than letting a friend make a mistake. Since people usually can't make smart decision alone, friends need to guide that right direction. Also, sometimes sitting back and allowing a friend decide whatever they want will worsen a friendship if something gets wrong with her.",//,essay,::
"The extended family (grandparents, cousins, aunts, and uncles) is less important now than it was in the past.",//,"Some people might say that the extended family is important. They could say they can learn about a profound family culture as one of reasons. However, I believe that the extended family is less important now, compare to the past decades. This is because people generally do not live with their extended family. Also, people in these days are too busy.

 

To begin with, it is not common that living with their extended family, or living close to their extended family today. Around two decades ago, it was common that living with or living close to a lot of family members including grandparents, aunts, uncles, and so on. However, as time goes by, the size of family has been decreased, and the frequency of meeting extended family has been decreased, too. This situation naturally discourages people communicate with their extended family. In a nutshell, it will be no difference between extended family and strangers in near future. Considering current trend, I believe that the importance of extended family is just an illusion.

Secondly, nowadays, people live in a big competition. All the things related to their life belong to the matter of competitions. For example, teenagers compete their academic grades, a business man compete their companies. There is no enough time to looking how their family lives well or similar things. According to the research conducted by Korean University in 2010, eighty-percent of people talks with their extended family once a month. Furthermore, half of the people who are in the eighty-percent answered that they do not care about their extended family because of their tight life. This result shows the fact that people do not consider their extended family as cherish human beings in the world, contrast to the past tendency.

To sum up, family separation has brought less communication and indifference to the extended family. Struggle for hot competition in these days prevents people from paying attention to their family members, especially to the extended family members. Taking all these things into account, I think the extended family is less important now than before.",//,essay,::
"In today’s world, it is more important to work quickly and risk making mistakes than to work slowly and make sure that everything is correct.",//,"Modern technological development has made our lives faster than ever before. Under this circumstance, people nowadays tend to live with the faster face, and people are now concern more about efficiency. As a result, doing things slowly and making almost everything correctly seems to be sort of out of date. In a modern society, people should, I believe, work at a higher speed and risk taking mistakes.

First of all, the development of modern technology has made our life faster than ever before. With the assistance of modern techniques, we consequently should work faster than ever before. For instance, in the old days people made their own clothes by hand. However, now machines in the factories have made sewing and weaving at a great speed and of great quality. We do not have waste any time doing cumbersome works because of the modern technology. Therefore, we should not insist to work at a slow pace instead of enjoying convenience that is brought by technology.

Another important aspect is, now we are living in a society which develops rapidly. To meet the rapid change and improvement, all of us need to improve our own efficiency. As we can see, almost every factory wants to increase its productivity and almost all the employers to generate greater value within the time limitation. Nobody wants to be a loser in the society, so the only way to keep pace with the whole society is to accelerate, which is, working faster. Admittedly, it is highly possible for us to make mistakes when working as a high speed. But in fact, we human beings make mistakes, so even if we work as slowly and carefully as possible, we still risk making errors. However, by taking the advantage of high self-efficiency, we can do our work more precisely than ever before.

All in all, in todaty’s world, people should work as a higher spped. It is so important that everyone in a modern society should be like that. It is a general tendency of the world.",//,essay,::
Should children learn about the notion of managing money? Do you agree or disagree?,//,"Some people might think that children do not have to learn about the notion of managing money because how to manage money can be educated by confronting the real situations in their future. However, I disagree because by learning managing money, children can practice to avoid monetary problems like bankruptcy and make their life be in high quality through the money.
 
To begin with, learning how to manage own money can reduce the possibility of falling monetary problems. We can see surround people who are in stress because of losing money. Most of this happening exists due to the wrong management. For example, people sometimes invest their money without profound consideration. Another case, someone lend their money to their friends without official documents. To prevent these situations, people should know how to manage their own money since they are young.
 
Moreover, people who manage their money well can enjoy their life with high quality. Even though pocket money cannot cover the expense of enjoying high quality life, such as travelling, learning, going concert, if money has been well managed, this life can come as reality. Let us suppose two persons. They get same amount of money from company once a month. One person saved one third of money, and spent remaining in buying necessary things. The other spent all the money for temporary amusements. One year after, the first person plan to world trip with saved money. The other also wants to go but he cannot do because he already spent all the money. However, he does not remember what he has spent in. This shows the problem of spending money without managing, in comparison with the effect of managing money.
 
Taking all these things into account, I firmly believe that learning to manage money from the age of child is significant. It helps us to avoid monetary problems as well as to enjoy their life in future.",//,essay,::
Young people do not give enough time to helping their communities.,//,"In old days, the society has not been developed much. So, almost everyone think that their communities need to be developed at that time. Then, they tried to put a lot of time into their communities to live better lives. However, the society has changed a lot, so that young people who live in modern age are not interested in their communities. Rather, they think things related to themselves more important. I also think more about individuals than groups.
 
 Nowadays, young people are concerned about their future because companies have reduced employment recently. Then, many young people should compete against each other to get a better job. To survive in the competition, they have to prepare for an English score and the internship and even voluteer work experience. Otherwise, their future might be unclear. So, that’s why young people focus on themselves rather than communities.
 
I am sure that another reason is that the technology has been developed a lot nowadays and it made our lives more convenient. Let me give one example of a mobile phone which is well-known as one of the most developed inventions in modern times. Young people spend a lot of time on doing their mobiles with a variety of applications. There are SNS(social network service), e-book and the Internet. They can find some information that they want and make new friends from other countries now. There are so many things to do using a mobile phone in modern days.
 
Taking these two reasons into account, I agree that young people nowadays do not give enough time to helping their communities. A majority of young people who want to get a good job should try hard to win the competition. In lifestyle, the technology has been already made breakthrough, so many things that we can not imagine in the past can be happened using a mobile phone.",//,essay,::
Should teachers be paid based on students' performances for the benefits of both students and teachers?,//,"Some people say that when teachers are paid based on students' performances, the education of school would be improved since it is clear that we are living in materialism society. However, as far as I'm concerned, teachers should not evaluated only by their students' grades for two reasons: teachers have to pay attention to not only how to teach effectively, and students would not no longer thank teachers' efforts on class. 
 
 First of all, teachers should also give attention to character education as well as class. This is very important and time-consuming education while the result rarely appears to be good grades. The purpose of schools is not only in improving students' intellectual ability, but also growing them as good members of society. Since we are living together having interactions, there is more possibility that success in life is up to one person's character like responsibility, morality, not rely upon how much knowledge they have. For example, There is a hairdressor from Korea who succeed in Philippines as a boss of tens of shops. Actually, he was not a honor student because he didn't like studying general subjects. However, he met a homeroom teacher when he was in middle school who always encouraged him to find his talent and emphasized and let know like growing leadership, time-management skill, and endurance are so important in life than winning good grades. He said that from the teacher, he got courage, got to know how to live an independant life, and he found his flair and decided to be a hairdressor. Even he said that his enterprise at present would not exist if she did not encouraged him. In this sense, we can know teachers' education much affect one's life,and this is not knowlege, but wisdom. Wisdom does rarely appear as students' grades, but it is essential for teachers to teach. When teachers are evaulated and paid only with their teaching skill, they are more likely to spend less time how they can make their students wiser and good members of society. Thus, I strongly believe that teaching skill cannot be a standard how much they get paid.
 
 Also, the relationship between students and teachers would more likely to be superficial. This is because students would think that the reason teachers spend long time how to teach effectively is only for his or her better finance, not from love for students. There is believe that educators are the people who educate students to cultivate good social being, so pupils respect their teachers since they feel teachers love their being although they get salaries. If such policy come to be true, they would regard the teachers who put a lot of efforts into class just instructors, and pupils would not also realize the true heart of educators to enhance their intellectual ability which let them live with widen perspectives. According to a survey conducted by psychology department of Chicago university, There was huge difference between two groups: A group of schools enacted the salary policy based on students' performances, and B group did not. The students of the schools of A group tended not to follow educators' advice, and the rate of the juvenile delinquent was higher about 30 percent more. Moreover, they were thinking teachers only educate for their financial condition, and they are not loved by them. In this sense, how well teach students should not be a criteion for educators' salaries.
 
 In short, if educators get paid based on students' peformances, for their high salaries, they would not spend enough time making students suitable members of society, and students would not appreciate their teachers' endeavor to develop teaching skill because they would think their effort is for money, not for love for pupils. For above reasons, I firmly disagre with the statement that teachers should get paid accoeding to their students' performance.",//,essay,::
"At universities and colleges, sports and social activities are just as important as classes and libraries and should receive equal financial support.",//,"Some people claims that universities and colleges should not spend a great deal of money om sports and social activities, as their budgets should prioritize classes and libraries. However, as educational institutions, universities and college have an obligation to provide a wide range of knowledge to their students to help them deveop academically and socially.

First of all, more and more business require people who are not only specialists in their fields, but also skilled in social interaction. In the rapidly changing environments of science and the economy, no task can be done by a single person. Given the need for collaboration, social skills and team spirit are necessary qualities for any successful person. Clearly, sports and social activities in universities and colleges provide students with the perfect settings to practice their social skills. By playing football on a team or joining in a protest, for instanace, students can develop a sense of belonging and experience team spirit, both of which may prove very important in building a career.

In addition, sports and social activities can greatly improve student’s efficiency. Students need not play sports or participate in social activities at the expense of their academic study. Indeed, for some students, playing sports and joining in social activities are good stress reducers. Even the most enthusiastic people feel tired if they focus on their one thing for too long. Frustrated and tired people can do nothing well if they do not recover from their bad situations. Students who have been frustrated in their academic work would be well-advised to play some sports or join in social activities. This demonstrates that universities  and colleges should spend adequate money on academics as well as sports and social activities.

To sum up, I maintain that universities and colleges should spend enough money on academic education and social movements to prepare students for their future development.  ",//,essay,::
